,post
0,I feel like I was born just to get the shit kick out of me 
1,"Being on call for nearly every day every week is starting to irk me Basically, I watch patients, high risk. I'm only supposed to be called in when a technician isn't available or they're busy. The past 2 times not only have I been called in with more than one tech, but they were dead and everybody is on their phones, doing nothing. I've finally got my sleep schedule back to normal so I get up at 4am naturally, do my errands, and I go to bed around midnight. Got called in the moment I get into bed and had to stay at the hospital for patient watch for 12 hours both times. I'm fucking exhausted and I have a tendency to fall asleep at the wheel of I'm tired. Tried telling that to my boss, he wants me to walk, which is a temporary fix for maybe 30 minutes. So yeah, I complain because I'm concerned for my health once I go home.  Probably me just being a bitch but fuck this aggravates me."
2,"9/11 WTC first responder - Pissed and desperate  As a first responder - I'm PISSED - I call up LHI and they are understaffed and could not find the faxes of my medical releases that I sent, but I was assured that they got them .  I wont mention names on here...  LHI got all my paper work and want to send me for medical treatment for PTSD and sleep apnea that is going to impact my cardiovascular health and in due time mess with my heart! I played their games, went to their doctors, sat on phones for hours at a time and I get the run around... LHI directed my call to my ""care team"" who NEVER picks up.  I leave messages and not even a call back. I'm GETTING sicker and I need some kind of certificate from the WTC Health network. I can not work. Im scared when I enter buildings. I had to move out of NYC up to the country - Just to get away from tall buildings and also if any - Chemical attacks.  I dont sleep = I'm on so much medication, just so I can feel somewhat normal and that stuff doesn't work. I went for counseling and feel like iam being judged and iam also giving this shrink a tragic story to talk about with his buds over a cold beer sitting around a fire pit. I have NO money - I'm on public assistance that pays for my lot rent for a mobile home and I get around $190 a month in food stamps. I'm waiting for my SSD case to be heard. (I also suffer seizures and back pain)  the back was something I was born with, but I FEEL the seizures are 9/11 related in some way - I'm sitting here venting because - I dont know what to do. I have papers from my doctors stating my conditions are permanent. I want to work but I cant' I went from making a very good salary to NOTHING    I need a break - I cant even pay my wifi or electric bill for the next few months and I need them both for my CPEP machine. the machine sends data to some doctor over wifi. I need help - Public assistance told me that the $420 for my lot rent is all they can do for me.  I need any type of assistance. I'm doing this alone with just my dog. I have no one else.     My dog says hi [https://i.imgur.com/d1amCRC.jpg](https://i.imgur.com/d1amCRC.jpg)   I dont mean to come off harsh - I just need help and I'm sick of living this way.  I just need a break for once. just until my SSD comes thru. "
3,"iphone 6s screen broke -- password got inputed incorrectly cuz of the screen spam, phone dead this sucks so so much my phone basically died on me like this , lost all my photos from the april month that i had thought got saved but randomly havent anymore , fuck this, my luck so bad"
4,"I am not talented, I am skilled! This is something that makes me so mad. I can draw pretty good, in fact I studied design and fine arts and I am so happy, that I could make my passion my job. HOWEVER I really hate, whenever people see my work and say things like ""Oh you are so TALENTED"". No. It is not talent - it is skill. I didn't spend the last 10 years drawing until my fingers bled and working my butt off at university to have people pass my skill off as just ""talent"" - That counts for everything in general, I think. Talent it just the Aptitude, either you are born with it or not - skill can be acquired by anyone, although ""talent"" makes it easier for you to progress in that field. Would you tell an architect ""Wow, good job in planning that skyscraper, you are so talented!"" - Certainly, you won't."
5,"Car's broken, credit and debit card have been stolen at the gym, I've neglected to purchase notebooks and folders, and college begins tomorrow. I'm in a big mess that's partially my own fault, and I cannot see how I'll fix it by tomorrow.  Please, life, no more surprises while I'm broke and in college."
6,"School favors extroverts and I hate it... I really wish schools and professors were more understanding of people with social anxiety, shyness, etc. There are so many people who don't participate much in class not because they don't want to, but because they literally can't without having some sort of mental freak-out. Yet participation remains a big part of grades and a lot of the time you can't fulfill it without speaking up in class at least every time. Some of my professors have offered other opportunities to get an A in participation (office hours, emailing questions), but the majority have not. And the worst thing is when professors claim to understand the struggle of shyness when they really don't- I've had multiple professors say: ""I understand that you're shy, but nobody is going to judge you! Just talk!"" First of all, most people who are shy know this. The knowledge does not cure the shyness. Second of all, if it was as easy as ""just doing it"" nobody would have problems. I'm tired of working twice as hard on my coursework as some other students but getting lower grades because they talk in class way more than I do. Some of them don't even contribute to the class discussion, they just talk about anything and it helps them. School really sucks sometimes... "
7,"Don't try to lecture me when you're a glorified secretary Tried to call in a follow up appointment for a family member who is 4 days post op. Her doctor is on vacation this week and is completely booked until the end of next month, so I'll have to wait until. I tell the person on the phone who is a ""scheduling specialist"" that I was specifically ordered by the hospital to get her appointment in the next 2 weeks, so I'll call back later once I confirm with the hospital and her surgical staff.   She says in the most obnoxious, condescending voice (my voice is high pitched, so people often think I'm a kid and lecture me). "" Now honey, I'm a specialist, since your mom is post-op she actually needs to see her surgeon first, then her primary care. It won't be a problem, trust me.""   I respond with, ""I just wanna call to confirm with the hospital first and...""   ""NO, listen honey, I understand that, but I'm sure that they would wanna do it this way""  ""Well I was instructed by his team at the hospital that...""  ""I UNDERSTAND, but you need to listen to me...""  ""No thanks, bye."" Anndddd I hung up.   Probably shouldn't have done that because I'm going to have to talk to this same person to schedule a meeting, but she was trying to convince me to trust her opinion over people who actually know the condition and have been working with the patient for weeks. She called herself a ""specialist"", but she's a ""scheduling specialist"" which makes her about as qualified to give medical advice as a pre-med student who just took Bio 1. "
8,"My rant on Love Fuckfuckfuck. Love is so fucking adorable. I feel so lonely when I see anything related to love. Cute couples, cute songs, cute quotes, everything. I just want a girlfriend. Or a boyfriend. I just want to hold someone’s hand. I feel even lonelier thinking about my crush who moved away. Let’s call her Mia. God fuck, she’s adorable. She’s beautiful, and has been there every single year and day of school with me. I could never imagine a day without her, but I have to live with it. I’m not even sure she likes girls. She’s just amazing, and we cried together In eachothers arms on the last day of school. I don’t think I can find anyone like that. I fucking love love. I just wanna have that one person who’s always there, who I can always rant to, and hang out with, and I just wanna cuddle with someone. I just want that one person. I had her, but she’s gone. Love is so strange. It makes you feel the warmest, and happiest feelings ever, but it can make you feel so, so, insecure, and sick. I can’t keep up with my feelings. I love love, but it fucks me up too.   “At this moment there are 6,470,818,671 people in the world. Some are running scared. Some are coming home. Some tell lies to make it through the day. Others are just now facing the truth. Some are evil men, at war with good. And some are good, struggling with evil. Six billion people in the world. Six billion souls. And sometimes, all you need is one.” –Peyton Sawyer, one tree hill "
9,"Best friend’s family putting their dog down because her legs don’t work (they’ve neglected her for 10+ years without medication) Their treatment of Marnie has aggravated me since they got the dog. They’ve NEVER taken her to the vet, and refuse to (“why would we pay for vet bills when we have to pay for our own insurance”).   The dad is very aggressive and dismissive towards her, and no one takes her out. She’s been peeing inside for the past ten years and they blame her for it (she was previously owned by an elderly woman that couldn’t take her out so she just peed indoors). Never tried any training or anything, just yell and shame her for it.   She’s lost the ability to move both back legs now at age 13 and the family has given up and will be putting her down next week. They refuse her WATER because they don’t want her peeing in the house, even though she cries for it. We took her out the other day and they yelled at her for sneaking over to a hole in the sidewalk to drink from a puddle.   I’ve known Marnie for those 10 years and I consider her to be my own dog at times. My friend and I are in college now so Marnie is alone in the house. I try and bring it up to my friend but she says “she’s lived her life, she can’t do anything now so she’ll be happier when we put her down”. Not sure how to deal with the situation but it’s so sad and fucked up and they don’t even care. I mean why even have a dog??        TL;DR Best friend’s family has a dog (13y) that they’ve been neglecting for years, now they’re putting her down because her legs don’t work and I don’t know what to do"
10,"driving!! ugh I'm so freaking stressed out because I take my drivers test tomorrow, and I'm so concerned that I'm going to fail that I haven't been eating right or sleeping well. It just really sucks, because I want to be able to drive so badly :/"
11,"Im awful and so tired God fucking damn im an awful person.  My family keeps talking about me because I apparently ""never show emotion"" or ""empathy"" or  how I never call or message or think or even care about anyone at all.  Yeah. I don't really care too much. They are right.  I don't have friends because there is an ""impenetrable wall"" protecting a ""never ending confusion mess of a maze"" that is my brain. This means I rarely ever share things about myself and conversations tend to be about the other person or just for jokes where I don't need to give my opinion . And when I share shit about me people leave cause im oversharing. If not people leave cause I never start conversations or because of this or because of that.  Yes. I have an explanation for all of that. I have an explanation to not talking to you lot. I have a reason to ""isolate myself in my own world"". First of all, fuck you, because you don't know what my world is. I do this because not only am I an introvert, I am also tired  I am tired of how society works, im tired of talking, im tired of trying, im tired of getting out of bed, im tired of living... I am just tired of this world. Everything feels the same. Why bother discussing a topic with someone that thinks they are always right? What's the point in discussing a topic with someone that doesn't admit when they are right ? What's the point in discussing a topic when they agree with you? What is ever the point in discussing a topic, really?  I don't talk to you because I don't have anything to say either. Im not going to pull topics and thoughts out of my ass to talk to be fucking judged. There is no point in that.   Im not going to study. Why waste my time to get a fucking letter that's supposed to ""help"" me get a job in the future, as if that even mattered? Im not going to work either. In fact I don't plan on living my 20s.  What's the point in keeping up with society? It's all about presenting ourselves as the prettiest smartest and wealthiest no matter what. All about hopping on the next trend and post a picture on Instagram of our perfect shitty flawed bodies to get likes for validation from other sorry excuses of living things, except we forget they don't care. No one does. The worst is if you don't follow such trends you are judged.  And what's the deal with people giving their opinions like they are fucking facts? Do they seriously think they are worth that much? That's just sad.   Really, what's the point in doing anything if you're not even going to live your 20s? There isn't one. I am cold and numb. I don't care about your shit. Not your existence, not your problems, not your wealth, not your social status. I don't care about the trend or how important studying or exercising is. I don't act upon any responsibilities either. Say whatever you want, you know in the end im the one that's going to end up alone. And it will all be my fault. I know that. I know this incredibly stupid but the fact that I am not willing to do anything to change myself further process my worthlessness and stupidity.  I don't even know what I am saying or why im typing this. I kind of just let my brain flow as I typed shit down. I can't be assed to reread it all anyway.  Thanks for reading."
12,"Why me I'm so fucking lonely. The girl I hoped to start a relationship with forgot about me over the summer and started a relationship with a different dude. I have a total of 4 friends (including this girl) currently with me in my college town. I want to do dating apps but at the same time I dont want to. I cant stay in my dorm room because i get too angry and bored, but at the same time i dont want to leave because i have no-where to go and nothing to do. Im constantly tired and have a headache. I cant start making friends because my hearing sucks ass and no one wants to be friends with the dude who's deaf. No one texts me to go do stuff, i always have to initiate to go do stuff with ""friends"". Im struggling in my courses that im paying thousands of dollars for because im so depressed that I cant motivate myself to do anything and i cant hear the professors because the whisper half the time. Everytime i eat i feel sick and as a result i dont eat much. The only thing I can take pride in, my work, i have no one to share this pride and victory with.   My life is way too lonely and it is finally ending me."
13,"And there it is again After day 4 or 5 of coming off of 24/7 work project and focusing my free time on finishing up my classes I'm greeted with, ""You know we're going away this weekend, so I don't want any drama between you, drama between me, any complications."" I was leaving this out before.....but considering I'm the one that pays all the bills and takes care of all the pets, and no I don't take care of the house or cleaning or whatever, but after spending about 20 hours a day for the past week and most days prior to that 16 hours a day between school and work, I'm kind of sick of it. I think this ""weekend getaway"" for labor day might be when I tell him if he needs to go, or is unhappy, maybe he just needs to fucking go. Because my lack of free time is not because I don't want to spend time together, my lack of free time is because I'm trying to make a future to fulfill all these fantasies of a future real housewives of whatever that he thinks we need to fucking have. Instead of just living day to day like normal people, I'm constantly coming home to I need this, we need that, wouldn't it be nice if we had, etc. So at this point, the just holding your head above the middle class lifestyle and not drowning bit isn't enough. It's always we need more and more and fucking more....but when I work for more it's you're not doing enough, you abandon me, you treat me like shit. Symptom of people in America (when I say that in a negative stance I mean the United States), always wanting fucking more, and then chastising people when they point out that more and more and more is not doable unless you kill yourself working for it. There are people in other societies, countries, cultures, etc, etc, etc, who do not need this much all the time. My husband, for someone that came from a family that was pretty simple and did not care about always having more, he's pretty fucking demanding....and godforbid I point out that he's going overboard, it's, ""Why do you always call me stupid! I'm not stupid! Don't treat me like this! What do you think people would think if they knew you abused me like this!"" As my friend Joy would say....Les Sigh!"
14,"Whelp the girl I love is in love with my sister...NEXT! Just found out the girl I've been pining over is in love with my sister via Instagram--even so far as to ask me what her situation is...  This is after months of trying to woo a little bit (as times are hard, living situation). Like, we've been living together for 6 months.  Mind you--my sister would be the last person to date her aside the fact she's straight. And guess what...I actually feel bad for saying that cause...in my eyes, they're both people I really care for.  *sigh*  Unfortunately, fortunately...NEXT'"
15,Lost a $50 I just realized I dropped $50 at the gas station a couple of hours ago and now I mad at self &gt;:[  How better making?
16,"""is there anything I can do for you during this hard time?"" Well actually, we have a GoFundMe set up because we can't afford a funeral. ""I'll be sure to share it and not donate a dime"" My Aunt passed away unexpectedly 2 days ago. My family and I got a tremendous amount of ""thoughts and prayers"" and not a single donation towards be the funeral. Screw your thoughts and prayers and condolences and empty ""let me know what I can do for you"" statements. You could skip getting your car washed this week and give us the extra 5 bucks you saved. 60 shares of the fundraiser and 0 donations. 60 people leave $50 and that's $3,000!! We finally got a donation last night and it's from a complete stranger. Someone we've never met can stumble upon our GoFundMe and give us $150 but best friends and close family can't spare a dollar?   Phew. I didn't even know there was a rant subreddit, glad I checked."
17,"I fucking hate ants. A fire ant just stung my nut sack. I am not kidding.   I live in Texas, and theres a lot of fire ants here. So I am just sitting in my room, minding my own business when suddenly I feel a poking sensation on my nutsack. Which was the bite. Then I feel what felt like my nuts being dipped in boiling oil. The fucker stung my nuts for no reason.  Ants suck ass.   Edit: I don’t have any other ants in my house, thanks for the advice but the ant most likely clung to my pants when I was outside. But I’ll remember the advice for when I do have an ant problem!"
18,"Dear ""Love all sizes or you're shallow"" people I agree that people shouldn't be made fun or discriminate for their weight but you can't control everything. People can decide to ""diet"" or work out plans and share their weight loss goals without you feeling attacked. I want to lose about 15lbs, not because I am brain wasted to believe that I'm not beautiful, because I personally don't like what I have going on right now. Honestly not sorry if this offends you, if you're offended from it then you should look within yourself."
19,"Writers should support each other you selfish assholes If I'm gonna go through the trouble of reading and commenting on y'all's work you could at least take a look at some of mine. I know I'm persona non grata because I write erotica but I've got other stuff up there too. I feel like I'm writing into the void.     I don't want to stop writing what I love just because other people don't like it, but it also hurts to be ignored all the time."
20,"I know I have bad skin, thanks for reminding me though You don't need to point it out to me. I'm already painfully aware of it. It's something I'm massively self-conscious about, but life has to go on. I've tried just about every form of treatment under the sun, with varying degrees of success. Making obvious suggestions like ""Have you tried cleansing?"" is an insult both to my appearance and my intelligence. You're pointing out something I'm super embarrassed about and can't seem to fix, no matter how hard I try. It serves no purpose except to make me feel worse.   Also, yes, my makeup is cakey. I know. It's not because I think it looks great; it's just what happens when you try to cover skin with rosacea, enlarged pores and acne scarring. I use primer and try not to be too heavy-handed with my foundation, but no amount of skill in the world can hide the fact that I'm starting with a rough canvas.   TL;DR, I know my skin sucks, so STFU. "
21,"Stop pretending to have an illness, to seem above of me. My title probably makes no sense but, let me explain. There is a person lets call her Kayla (no offence if this is your name).  I have discontinued all contact with her, and blocked her on all social media. I don't need the toxicity of her in my already kinda stressful life  Kayla claims to have so many problems (mental and physical.) However, many of these are fake. I give the benefit of the doubt and will believe what you tell me. But, then I started noticing things. Firstly, Kayla would use her 'illnesses' as an excuse for things. Like ""oh, I can't do *insert thing here* because of my anxiety"" or something like that.   Also, I have problems myself (mental, not sure about medical. Other than a nose bleeding problem, but that is nothing serious, a trip to the ENT will cover that) but, she claims because she has more problems and that they are more severe that she knows more about the problems and that she also can basically take control over me, be smarter and better than me.   Kayla is quite popular and stuff and does cheer-leading, gymnastics, dance (i think), volleyball, soccer (i'm not sure if there is anything else.) Not far too long ago, I did some research. With her claims on some of the 'conditions' she has, she would not be able to do any of the sports or any sports at all really.  Also, she claims she has epileptic seizures (Photosensitive epilepsy to be specific) Here are two straight out reasons that's clearly a lie. 1) She went to a f***ing Taylor Swift concert (that is flashing lights galore, you would probably not survive that or something) 2) I have never seen her take medications (I have been over to her house plenty of times, including for sleepovers and had never seen her take a single medication)  She also claims to have autism. Which kinda hits close to home for me. I have a family friend with autism. I know there are different types on the Autism Spectrum but she has 0 signs/symptoms of any of them.   She just claims to have so many things she doesn't have. Is the possibility of munchausen syndrome there, well possibly. Like I said often i give the benefit of the doubt, this could be a case of it. But, at the same time it could just be her trying to seem 'trendy' or something. "
22,Just remember Yelp reviews are left by people who leave yelp reviews!
23,"Constipated for over a month And it keeps getting fucking worse. People telling me it'll be ok. First time when I got real pain I went to the ER (dunno if that's the right word) and I got some fibre supplements (2 a day), it worked, a little, but still not enough. Then on my own initiative I got laxative pills (Talked to my doctor about it) and they worked a little too. But it still wasn't over and I kept feeling more and more bloated.  &amp;#x200B;  Now fast forward to when it really started bothering me again, like, 3 weeks in, my doctor upped my dosis of fibre supplements to 6 per day and 2 laxative pills per day. I also had a few tiny 5 ML enemas that kinda...? worked. Few weeks later, back at the ER after waiting for my doctor's go ahead. Pains that have held for about 12 hours.  &amp;#x200B;  Have to wait for hours to get somewhere; get an unsolicited finger up my ass, an hour later an enema (that did not work as well as intended)  &amp;#x200B;  There was blood and slime present, so who knows, maybe I got  Ulcerative Colitis (Cause my mother has it) but the doctor said it was likely due to the enema.  &amp;#x200B;  I got one to take home, failed kinda. Then took another one the next day, worked, kinda? But still feel like there's a balloon inflated in my stomach and it's just so fucking annoying, I can barely eat anything without getting full, but eating nothing isn't an option either because then my intestines will just stop moving alltogether  &amp;#x200B;  So yeah...   &amp;#x200B;  Oh, and did I mention I had surgery a few weeks ago, and I'm still recovering from that?"
