,post
24,"I hate depression memes I saw the truth hole comic on the front page today, and I’m just sick of it. I’m sick of seeing everyone be miserable. I’m sick of feeling miserable. I’m sick of hearing everyone have these cliche dark jokes on nembutal and exit bags. I just want to shut my eyes and not see this epidemic happening. It’s like when every celebrity came out with their own unique criticisms of Trump. I can’t hear the news anymore. I feel like I’m hearing about these suicides occurring within a broad range of people, and I just don’t want to hear it anymore. All I want to say is, I sympathize with the situation, but it just doesn’t get us closer to reducing suicides. "
25,"Why me Why am Is this break up hitting me so hard? Why do I feel this way if I broke up with her? Why is this making me act so crazy? Why is she acting like she doesn’t care? Why did she tell me was stuck on her ex after we broke up? Why did she let me waste so much time? Just why she was supposed to be the one? I gave her everything she deserved and more, treated her like a queen and didnt get any of the same treatment and I was the only one trying but not all of sudden super heart broken because we broke up.. I dont get it"
26,I just saw a small roach and a little bug in my bed.... I'm concern...should I start buying a new mattress....I don't even know if the small bug is a bed bug....
27,"I hate to develop my feelings for someone!!!! I'm tired of developing my feelings for someone who I have no chance with!!! Few years ago, I swore that my crush was going to be last guy I have feelings for! I thought he might likes me but I was wrong because he got a girlfriend a year later. I am not going to like a guy again unless he likes me first! Last year, I unfortunately developed my feelings for another guy and I didn't try to!!! I didn't know what the hell I was supposed to do! I still have feeling for him after a year... He doesn't know that I like him but he doesn't need to know.  This time, he is going to be LAST guy I have feelings for! After that, I am done!!! A guy should develop his feelings for me first! I'm tired of being hurt all time! I'm tired of possible one-sided love! I want mutual feelings! I'm sooo tired of this crap!! Why did I have to develop my feelings for someone??? I didn't try to!!! I tried to deny my feelings and in my mind, I was like, ""No, don't like him! Please don't fall for him! He is definitely a friend! No more than a friend."" Unfortunately, I fell for him!!! I'm so fed up!!"
28,"I cannot stand my best friend of over 5 years anymore. She is getting so fucking irritating! Not only do i get paragraphs sent to me every 3-4 hours about her life, I get criticized when I give the simple solution that could solve all of her problems that she is complaining to me about. I’m done with it. I am basically her personal therapist and it is killing me inside. Her life is kind of rough, but she could make it better by just doing some simple things! She also doesn’t really know anything about me anymore. It’s a one way friendship. She got pissed off when she heard about the new romantic interest in my life from someone else. Maybe she would’ve known if she didn’t talk about herself 24/7. I really cannot deal with her. "
29,"Fuckin' Tom Yorke And Simon and Garfunkel...and Damien Rice. I can't make a career out of the sadness and general depression I feel inside, because I have no talent. I'm called selfish, immature, ungrateful, unwilling to snap out of it, etc., and they're making millions off of it. The ""it"" I speak of is the crushing weight of the world and the general emptiness and sadness one feels when they're depressed. They were able to create lyrics from it, and were able to entertain millions from it. I on the other hand cannot sing, write music, play instruments, etc. I can't direct films or do any kind of entertainment that stems from inspiration caused by my mental illness. I just have it. Wish I could put it into words or songs or movies or fuckin videogames or something so I could capitalize on it. But no. I have to suffer and be ridiculed. "
30,BetterHelp I applied to BetterHelp to get therapy and they turned me away. Apparently in their eyes I'm beyond help or they're too shitty to help someone who's suicidal.  I figured it would be more convenient since i usually want to discuss my feelings at night/early morning plus it would save on gas.   A fucking app that is all about therapy turned me away because i need therapy. What a fucking pile of shit.
31,"I hate my family All they do is look down at me. If I’m doing something beneficial for myself, then they copy what I do. I don’t speak with them even though we live in the same house. Everyone is hating on me and wants to see me fail so they can feel better about themselves. There’s no support whatsoever and there is no confidentiality with them. It’s like living with your worst enemies, it’s toxic. I hope to graduate soon so I can move out. I will cut contact with them as soon as that occurs 100%."
32,I deserve to be unhealthy unhappy and tired 
33,"I’m so tired of not having it be an ideal situation to be happy. I’m so fucking tired of this shit. Four year relationship ended because I couldn’t pursue a university in the country of both our choices because my dad lost his job my mom got cancer and I had to stay and help. I hate it here so fucking much but I’m stuck for atleast two more years. Anyways, ever since then it’s been nothing but pointless emotionless hookups and one to two week relationships. I’ve been talking to this girl I met online for about 9 years now, she’s my best friend, we know everything about each other  and oh my lord I love her so much and she feels the same way but she lives on the other side of the world so rip I guess. A while ago I reconnected with an old friend, we both ended up admitting we liked each other in high school and ever since spending time with each other we found out those feelings are still there  and since then sparks went flying ,but the amount of chances I got to kiss her and become more intimate got killed with the thought of not wanting to fuck up a friendship since a relationship is out of the question. since she’s only here for the summer and is going back to her home country next week. We even went on a fad date to see how it would be and it was amazing.  Another girl I liked after like a year of having no chemistry with anyone, yeah my friend screwed that up for me. Not going into details but let’s just say he’s a jackass. Before all of this even happened the first girl I ever went out with, she was amazing and we where a perfect match. I only ended up going out with for two days because well what do you know, when I went to tell my best friend at the time about her, I find out hes had a crush on her for years and it was hurting his feelings and so I backed off. Only to talk to her last night after years and years of no contact to her asking me why I broke it off with her to me admitting it. Only to find out that she rejected him way before she even met me because they went on a date and afterwards he told the entire fucking city that she slept with him when she didn’t. I am so tired of all this shit and never even getting a chance to be happy with someone because of such stupid little hiccups , I want to cry , but I haven’t cried in years and I try to force out a tear to just try to get some emotion out but I just can’t it feels like shit. And that’s why I’m writing here on a brand new account even though I can write it in my main and everyone will see, I usually don’t care and am an open book but right now I just feel so pathetic. "
34,"Every single one of my friends is my best friend, but I’m no one’s best friend. I know it sounds like a middle school existential crisis, but I’m not in middle school and it still hurts... a lot. I’m there for everyone, and I try not to be a people pleaser, but I am and I’m still no one’s best friend. Do you know how hard it is to not have anyone to talk about serious things? Or not have a person who’s comfortable enough around you to talk about their problems with you? It really makes me feel like I don’t matter.  And when I actually try to talk about my problems with my friends, they either take it as a joke, not pay attention while I talk, or think I’m exaggerating, and that makes me feel like my problems don’t matter either. This is really painful, and I never say it to anyone, I just keep it to myself. "
35,"Im afraid my relationship w my boyfriend is ending We have been dating for three months. Said the I love yous pretty early. I went to college about a month ago and two weeks ago he broke up w me (over text) bc he didn't think he could handle a long distance relationship (even though when we met, we live an hour away and now we live... A whole... Two hours away now!)(but I mean.. props to him for being somewhat honorable and not just cheating on me right?) And after I sort of kind of went not really but sorta went off on him (I mean I told him how I felt. But I didn't say it angrily or mean. I was never angry with him. Just really sad) he kinda sorta not really begged for me back (it took a whole lotta convincing). I went to ""spend the weekend"" with him for the first time ever and things were kind of weird. Not weird we just didn't talk a whole lot. It was kinda like ""old"" times (as old as you can get in 3 months) but there was just less talking and more watching TV and sex ya know. That was this last Friday and now it's Wednesday and he's working and I'm at band camp and we can't talk a whole lot. And his work puts him in a lot of physical stress so when he says he's tired I don't really text him a lot and this week's been particularly taxing on him...  I'm just scared it's gonna happen again. I suddenly have this insecurity about us and it feels just awful. I know he loves me. I told him if we broke up again it would be the final time. I'm just scared"
36,"Self Doubt! I wish I was something more. I only want to do better. I want to give more than what I have. I wish I was the best, I wish I was important, I wish I was someone people liked to talk to and be around. Myself as a whole is just not enough for a lot of people. No one cares to give me the time of day anyways. Those who do quickly lose interest. I wish I was someone better. I feel like no one gives me credit. I feel very unappreciated. Honestly, I wish people gave me validation! I feel very invalid. Inapplicable. I wish I was someone people looked forward to seeing. I wish I could feel important somewhere, anywhere on this earth. I put so much effort and time and dedication into shit just to get nothing in return and it's been like that for years. Maybe I'm just putting my energy into the wrong shit. But where is the right thing for me? What is it?   I'm just putting this out there into the void of the internet. It's a place to scream, since there isnt any where else to anymore. "
37,"Schizoaffective Mother Draining My Energy and Making Me Feel Bad About Life My mother is diagnosed with Schizoaffective Disorder. For those who do not know about this type of mental illness, it is basically a combination between Schizophrenia and Bipolar Disorder. Her symptoms include mania and depression with an add-on depending on her delusion and paranoia.   Prior to us migrating to the US, I have always thought my mother was great when I was younger. However, the stress of living in the US in poverty was too much for her and the negative criticism from her family members broke her down and she developed Schizoaffective Disorder. I eventually was placed in foster care after an incident where her delusion resulted in her physically abusing me was witnessed by a residential manager where my mother and I stayed.  Foster care wasn't paradise but I learned a lot from being in numerous placements. I understood how other culture operated and how a normal family was supposed to run from the sideline. I have always understood that the family that I was placed with are not my blood and there are barriers because of that - realizing it made me sad at first and it still do but that's the reality of nature. Throughout my foster care years, my mother was on and off her meds before she finally stabilized for a long period of time throughout my high school and college years.   Recently, she went off her meds again and that was an ordeal that I won't soon forget. I have made several posts about that in r/needavice but I won't mentioned that here because I wanted to rant about the emotions that I am feeling reeling from my mother's behaviors.   My mother is currently getting an injection every month (which I hope she is telling me the truth about that) so she's somewhat stable. I feel so suffocated by my mother in a sense that I feel that I might step on a landmine everyday having her in my life. When she recently went off her meds, I asked her why she wasn't taking her meds and she said it was because she was angry at my uncle and me. I didn't say it straight to her but I thought to myself that it was unfair that she would punish our stable lives by going off her meds. Just last week, she saw a picture of me at my Aunt's place and she got sad saying why did I visited my Aunt instead of her. I tried telling her that when she was off her meds my Aunt/ her best friend was extremely helpful in making sure that she's okay. She was the one that acted like a mother to me when my own mother was yelling on the street and having delusion thoughts. During her episodes, I was so scared of her and my Aunt was there for me to help and give me the support for me call the police/ help for my mother. When I told her that, my mother interpreted that I don't love her but all I was trying to make her understand that I am just a kid and I am scared of you when you're off your meds.   My mother gets angry easily by things that don't go her ways. There's no logical reasoning to her. Every time I tried to reason my perspective with her she said that she's older than me and that I have to listen to her and that I don't know anything. If I continue to press my opinion on a matter then she would throw something like if anyone that she doesn't like (my uncle/ her brother or my aunt/ best friend) have taught me to say these things to her. I feel abuse and this severely hurt my self-esteem as it seems like I can't even hold my own perspective/ opinion about anything.   As I said, my mother have a hard time to getting along with people. While my uncle is her brother and aunt is her best friend, if she gets mad at them then she won't talk or call them, in turns they just avoid her until she needs their help. I have a hard time following the same strategy as they do because I want my mom to be well. It's just difficult to be interactive with my mother. I have to watch what I say and what I do around her for her to not be angry at me. Although I live close to my mother, I have been lying to her about where I live because I don't feel comfortable with telling her my new place where she might show up with an episode and cause a scene.   Because of my past, I have been a passive person and never liked confrontation. I have observed and concluded that my mother holds grudges about what have happened. I have multiple times tell her that she has to let go of the past and be happy but she insist that whoever have done us wrong in the past we must return the favors. She doesn't connect well with others and instead put a lot of pressure on me to give her the love of a community and unrequited which I am happy to if she would return the logicality and understanding that I am looking for. But she does not and I feel discouraged, sad, angry, disappointed, worrisome, and anxious whenever I talk to her.   I have been involved in my mother's case planning with disabilities services and they're disappointing. Multiple times, I have to chase service providers down and play phone chase with them just to get updates on my mother. The timetables that they give me are never accurate about when they would return my calls or give me the information that I need to help my mother.   I have talked to my support group which includes my mentor, friends, extended-family members, and foster family and they have given me some advice but I still feel isolated. My mentor have told me that even if I move away and cut off all my contact with my mother then I would not be satisfied because I would worry about her.   Right now, I feel bleak and despair. I know life is unfair but when do things look up from here. I feel alone and too immature to handle this kind of situation. I feel that I don't have the permission to live the life that I want to live but rather picking up the messes that my mother leave behind and having to entertain her. Maybe I am whining and I apologized if I am because I know there are worst lives out there than me. Thank you for listening to my story. "
38,"Why I can’t get over her My girlfriend and I broke up about two months ago. It was her decision and all of my fault for not thinking anything through before I go ahead with it. These things aren’t too serious but they are in the category of making and following through with plans. Looking from the outside in with our relationship one would question a lot of the things I did that made her angry and the things she said after the fact. All of that in mind I can’t help but feel guilty with all of the stuff I have done and I am completely responsible for the downfall of our relationship. I ruined one of the greatest things that has ever happened to me. 2 years I had the chance to wake up and fix myself but I didn’t. I was selfish, inattentive to her needs, and worst of all lazy.   I had two chances to fix myself when we broke up but all of that went to waste. I don’t blame anyone for telling me to move on but I can’t right now. Despite my shortcomings I loved her and helped her through the worst period in her life. When all of those things happened I was right by her side no matter what. I loved her personality, her past, her aspirations, and her flaws most of all. I was never one to send surprises but I was one to sacrifice almost everything to make sure she was okay. I know I have to give up my love for her some day but for now i’ll hold onto it and treasure it. I hope all of you that read this take the time to treasure the people that you have fallen in love with.   We often take for granted what we have become accustomed to and when it is gone it may very well be our downfall. Be kind to each other, cast aside your pride when the time is right, and most of all fight to change the setbacks of your relationships. "
39,"pls stop i just so tired of due dates and summative stuff due, on top of that are summative performances and exams. Just so sick from the work, it keeps on coming like wave after wave. The workload piling up so much that it blocked my view of the light.  friends and family Expecting me to do well but little do they know that im the black sheep. Getting out of bed is such a pain that i want to go to bed again, not to sleep but to lay there and do nothing. I cant think straight with all the weight on my shoulders, i try to look strong by putting on a smile and telling people nothings wrong. so sick of this year, so sick of my life, so sick of all these problems. Just wanna feel to be alive again. Sorry if this dont make any sense, i needed to rant.   &amp;#x200B;"
40,"I'm tired of trying to be better. I wish I could just self destruct in peace. I wish I could just stop talking to everyone who cares and drink myself into oblivion. I regret joining AA. I regret getting therapy. I regret making sober friends who care if I drink or not.   If I wasnt taking up their time (my friends, therapist, sponsor) they would have taken someone else under their wing. They would have more time to help people who were better then me and more willing to change.   I want to give up. I'm tired of trying to get better. It's fucking exhausting and I'm just so fucking tired of it all"
